|job_href|job_title|employer|city|salary|schedule|conditions|responsibilities|education|experience|requirements|placement|job_views_value|job_simple_dis_sec
133|https://joblab.ru/vac10845645.html|Специалист по подключению абонентов|JCat|Ясный|от 55 000 руб.|Полный рабочий день|Что предстоит делать:, подключать услуги домашнего интернета и ТВ: проводить монтаж оборудования в доме абонента, устранять неисправности при необходимости, помогать клиентам выбрать тариф, настроить роутер или ТВ приставку, показывать, как работает сервис, Для этих задач мы ищем:, специалиста с опытом или без. Наставники научат монтажу и работе с инструментом с нуля, Что Вы получите, придя к нам:, стабильность: официальное оформление договору гражданско-правового характера (ДГПХ) или договора с самозанятыми (договор возмездного оказания услуг) , гибкий график работы, удобный график можно обсудить на собеседовании с руководителем, возможно совмещение с основной работой или службой в армии, своевременные выплаты и доход, в среднем наши сотрудники зарабатывают 55 тыс. руб . при графике 2/2, льготные тарифы на связь и домашний интернет, скидки от партнеров, профессиональное развитие внутри компании, слаботочные # сети # системы # слаботочка # начинающий # скуд # витая пара # видеонаблюдение # опс # сигнализация # установка # сервисный # техник # технический # специалист # прокладка кабеля # инженер сетей # монтаж # монтажник||Среднее|Не требуется||17.10.2023 22:02:00|54|
134|https://joblab.ru/vac10887364.html|Начальник управления информационных технологий|JCat|Москва|По договоренности|Полный рабочий день|"Условия, Работа в офисе., Испытательный срок - 3 месяца., График работы 5/2., Оплата обсуждается индивидуально., Требования, Знания и опыт сопровождения банковского ПО: АБС (предпочтительнее Юнисаб (UBS NET, Unisab)), ДБО ""Ibank2"" АРМ КБР-Н, СМЭВ, Дельта, АСВКБ и другое ПО., Знание Microsoft AD., Знание ОС Windows 10, Windows Server 2012 и выше., Microsoft SQL и другие СУБД., Знание Linux., Умение проводить диагностику оборудования и оперативно устранять неполадки., Знания и опыт работы с СЗИ (Secret Net Studiо, Соболь и т.п.), Знания и опыт работы с серверным и сетевым оборудованием., Опыт построения центров обработки данных, в соответствии с требованиями регуляторов., Знания и опыт работы с СКЗИ., Образование высшее: информационные технологии, Обязанности, Сопровождение/поддержка АБС ""Юнисаб"" (UBS NET, Unisab) ., Сопровождение/поддержка клиентов ДБО IBANK2., Сопровождение системы ДБО IBANK2, Сопровождение АРМ КБР-Н, Disec-w, АРМ КБР-СПФС., Сопровождение прикладного банковского ПО., Сопровождение инфраструктуры., Взаимодействие с подрядчиками/партнерами/поставщиками., Сопровождение/поддержка сотрудников."|"Условия, Работа в офисе., Испытательный срок - 3 месяца., График работы 5/2., Оплата обсуждается индивидуально., Требования, Знания и опыт сопровождения банковского ПО: АБС (предпочтительнее Юнисаб (UBS NET, Unisab)), ДБО ""Ibank2"" АРМ КБР-Н, СМЭВ, Дельта, АСВКБ и другое ПО., Знание Microsoft AD., Знание ОС Windows 10, Windows Server 2012 и выше., Microsoft SQL и другие СУБД., Знание Linux., Умение проводить диагностику оборудования и оперативно устранять неполадки., Знания и опыт работы с СЗИ (Secret Net Studiо, Соболь и т.п.), Знания и опыт работы с серверным и сетевым оборудованием., Опыт построения центров обработки данных, в соответствии с требованиями регуляторов., Знания и опыт работы с СКЗИ., Образование высшее: информационные технологии, Обязанности, Сопровождение/поддержка АБС ""Юнисаб"" (UBS NET, Unisab) ., Сопровождение/поддержка клиентов ДБО IBANK2., Сопровождение системы ДБО IBANK2, Сопровождение АРМ КБР-Н, Disec-w, АРМ КБР-СПФС., Сопровождение прикладного банковского ПО., Сопровождение инфраструктуры., Взаимодействие с подрядчиками/партнерами/поставщиками., Сопровождение/поддержка сотрудников."|Высшее|От 5 лет|"Условия, Работа в офисе., Испытательный срок - 3 месяца., График работы 5/2., Оплата обсуждается индивидуально., Требования, Знания и опыт сопровождения банковского ПО: АБС (предпочтительнее Юнисаб (UBS NET, Unisab)), ДБО ""Ibank2"" АРМ КБР-Н, СМЭВ, Дельта, АСВКБ и другое ПО., Знание Microsoft AD., Знание ОС Windows 10, Windows Server 2012 и выше., Microsoft SQL и другие СУБД., Знание Linux., Умение проводить диагностику оборудования и оперативно устранять неполадки., Знания и опыт работы с СЗИ (Secret Net Studiо, Соболь и т.п.), Знания и опыт работы с серверным и сетевым оборудованием., Опыт построения центров обработки данных, в соответствии с требованиями регуляторов., Знания и опыт работы с СКЗИ., Образование высшее: информационные технологии, Обязанности, Сопровождение/поддержка АБС ""Юнисаб"" (UBS NET, Unisab) ., Сопровождение/поддержка клиентов ДБО IBANK2., Сопровождение системы ДБО IBANK2, Сопровождение АРМ КБР-Н, Disec-w, АРМ КБР-СПФС., Сопровождение прикладного банковского ПО., Сопровождение инфраструктуры., Взаимодействие с подрядчиками/партнерами/поставщиками., Сопровождение/поддержка сотрудников."|17.10.2023 22:02:00|48|
135|https://joblab.ru/vac10887367.html|Руководитель сотрудник отдела сопровождения информационных систем|JCat|Москва|По договоренности|Полный рабочий день|"Условия, Работа в офисе., Испытательный срок - 3 месяца., График работы 5/2., Оплата обсуждается индивидуально., Требования, Знания и опыт сопровождения (поддержки сотрудников) банковского ПО: АБС (предпочтительнее Юнисаб (UBS NET, Unisab)), ДБО ""Ibank2"" АРМ КБР-Н, СМЭВ, Дельта, АСВКБ и другое ПО., Знание Microsoft AD., Знание ОС Windows 10, Windows Server 2012 и выше., Microsoft SQL и другие СУБД., Знание Linux., Умение проводить диагностику оборудования и оперативно устранять неполадки., Знания и опыт работы с СЗИ (Secret Net Studiо, Соболь и т.п.), Знания и опыт работы с серверным и сетевым оборудованием., Опыт построения центров обработки данных, в соответствии с требованиями регуляторов., Знания и опыт работы с СКЗИ., Образование высшее: информационные технологии, Обязанности, Сопровождение/поддержка АБС ""Юнисаб"" (UBS NET, Unisab) ., Сопровождение/поддержка клиентов ДБО IBANK2., Сопровождение системы ДБО IBANK2, Сопровождение АРМ КБР-Н, Disec-w, АРМ КБР-СПФС., Сопровождение прикладного банковского ПО., Сопровождение инфраструктуры., Взаимодействие с подрядчиками/партнерами/поставщиками., Сопровождение/поддержка сотрудников."|"Условия, Работа в офисе., Испытательный срок - 3 месяца., График работы 5/2., Оплата обсуждается индивидуально., Требования, Знания и опыт сопровождения (поддержки сотрудников) банковского ПО: АБС (предпочтительнее Юнисаб (UBS NET, Unisab)), ДБО ""Ibank2"" АРМ КБР-Н, СМЭВ, Дельта, АСВКБ и другое ПО., Знание Microsoft AD., Знание ОС Windows 10, Windows Server 2012 и выше., Microsoft SQL и другие СУБД., Знание Linux., Умение проводить диагностику оборудования и оперативно устранять неполадки., Знания и опыт работы с СЗИ (Secret Net Studiо, Соболь и т.п.), Знания и опыт работы с серверным и сетевым оборудованием., Опыт построения центров обработки данных, в соответствии с требованиями регуляторов., Знания и опыт работы с СКЗИ., Образование высшее: информационные технологии, Обязанности, Сопровождение/поддержка АБС ""Юнисаб"" (UBS NET, Unisab) ., Сопровождение/поддержка клиентов ДБО IBANK2., Сопровождение системы ДБО IBANK2, Сопровождение АРМ КБР-Н, Disec-w, АРМ КБР-СПФС., Сопровождение прикладного банковского ПО., Сопровождение инфраструктуры., Взаимодействие с подрядчиками/партнерами/поставщиками., Сопровождение/поддержка сотрудников."|Высшее|От 5 лет|"Условия, Работа в офисе., Испытательный срок - 3 месяца., График работы 5/2., Оплата обсуждается индивидуально., Требования, Знания и опыт сопровождения (поддержки сотрудников) банковского ПО: АБС (предпочтительнее Юнисаб (UBS NET, Unisab)), ДБО ""Ibank2"" АРМ КБР-Н, СМЭВ, Дельта, АСВКБ и другое ПО., Знание Microsoft AD., Знание ОС Windows 10, Windows Server 2012 и выше., Microsoft SQL и другие СУБД., Знание Linux., Умение проводить диагностику оборудования и оперативно устранять неполадки., Знания и опыт работы с СЗИ (Secret Net Studiо, Соболь и т.п.), Знания и опыт работы с серверным и сетевым оборудованием., Опыт построения центров обработки данных, в соответствии с требованиями регуляторов., Знания и опыт работы с СКЗИ., Образование высшее: информационные технологии, Обязанности, Сопровождение/поддержка АБС ""Юнисаб"" (UBS NET, Unisab) ., Сопровождение/поддержка клиентов ДБО IBANK2., Сопровождение системы ДБО IBANK2, Сопровождение АРМ КБР-Н, Disec-w, АРМ КБР-СПФС., Сопровождение прикладного банковского ПО., Сопровождение инфраструктуры., Взаимодействие с подрядчиками/партнерами/поставщиками., Сопровождение/поддержка сотрудников."|17.10.2023 22:02:00|52|
136|https://joblab.ru/vac10978813.html|Менеджер по работе с клиентами в онлайн-школу макраме (удаленно)|JCat|Ростов-на-Дону|от 55 000 руб.|Полный рабочий день|"Приветствуем Вас, наш кандидат, Мы - команда онлайн-школы макраме ""Zacramaschool""., Наша школа входит в ТОП-3 школ по макраме. За несколько лет работы мы выпустили более 1000 учеников по всему миру и продолжаем увеличивать обороты., Наша цель - создать лучшую онлайн-школу современного макраме., Сейчас мы ищем энергичного и целеустремленного менеджера по продажам, который будет заниматься звонками и перепиской с клиентами с целью продажи наших курсов., Условия:, Работа полностью удаленно / inhome / home office, НЕ ПОДРАБОТКА, полная занятость, График работы: 5/2 по 8 часов, с плавающими выходными (не обязательно Сб и Вс), Заработная плата от 55 000руб. (оклад 15т.руб. + % от продаж), БЕЗ поиска клиентов. БЕЗ холодных звонков, Экологичные продажи, CRM-система с подключенной качественной телефонией., Требования:, Опыт работы в продажах от 1 года (желательно), Дисциплинированность, готовность работать без лишних напоминаний и постоянного контроля, Грамотная устная и письменная речь, Уверенный пользователь ПК, Наличие гарнитуры (наушники с микрофоном), Прохождение обучения и стажировки., Обязанности:, Быстро принимать и обрабатывать входящие заявки, Выявлять потребности и презентовать под них подходящую программу, Работать с клиентской базой (физические лица, которые регистрировались на вебинар), Контролировать поступления денежных средств от клиентов, Предоставлять отчеты по выполнению планов и поставленных задач РОПу., Если любите деньги и продажи, интересуетесь макраме, и готовы стать частью нашей истории, скорее откликайтесь. Мы будем рады рассмотреть вашу кандидатуру"||Среднее|От 2 лет||17.10.2023 22:02:00|83|
137|https://joblab.ru/vac11120908.html|Менеджер-аналитик по работе с Wildberries|JCat|Казань|30 000 — 80 000 руб.|Полный рабочий день|Обязанности:, Регистрировать личные кабинеты Wildberries, Создавать карточки товаров на площадках Wildberries, Загрузка новых товаров на маркетплейс Wildberries: обработка исходных данных и самостоятельный поиск недостающих, проверка качества фото и описаний, составление и корректировка ассортиментной таблицы, Исправление ошибок в уже существующих товарах, Загрузка документации к товарам, Сопровождать поставки клиентов, Анализ категорий в SellerStats (либо в других сервисах аналитики), поиск новых ниш, ABC- анализ XYZ- анализ, Расчет общей рентабельности продаж и рентабельности отдельного товара (юнит-экономика), Анализ карточек товаров на маркетплейсе, рекомендации по их оптимизации, SEO- оптимизация названий товара, Анализ эффективности рекламы на маркетплейсе и рекомендации по оптимизации рекламы, Аналитика, план и рекомендации для повышения продаж на маркетплейсе, Аналитика конкурентов, конкурентный анализ маркетплейсе (продажи/товары/цены). Знание работы инструментов аналитики продаж маркетплейса, Анализ рынка (конкуренты, тренды, спрос и цена)., Увеличение объемов продаж, расчет оборачиваемости, маржинальности площадок, Разработка стратегии продаж через МП, Расчет цены товара, скидки, промокодов, Формирование ассортиментной матрицы, Продавать доп.услуги компании, Требования:, Уверенный пользователь ПК, Свободное владение Excel, Опыт работы на маркетплейсе Wildberries (если ты знаешь механизм работы Ozon, Яндекс.Маркет, и т.д. - это будет твоим преимуществом), Опыт в продажах, Умение вести переговоры, Интерес к сфере e-commerce и IT, желание развиваться, Условия:- Офис в центре города, График работы 5/2, с 9 до 18, Оплата 2 раза в месяц, Важно: Удаленный график работы не рассматриваем||Среднее|От 1 года||17.10.2023 22:02:00|31|
138|https://joblab.ru/vac11168581.html|Менеджер по работе с клиентами в онлайн-школу макраме (удаленно)|JCat|Нижний Новгород|от 55 000 руб.|Полный рабочий день|"Приветствуем Вас, наш кандидат, Мы - команда онлайн-школы макраме ""Zacramaschool""., Наша школа входит в ТОП-3 школ по макраме. За несколько лет работы мы выпустили более 1000 учеников по всему миру и продолжаем увеличивать обороты., Наша цель - создать лучшую онлайн-школу современного макраме., Сейчас мы ищем энергичного и целеустремленного менеджера по продажам, который будет заниматься звонками и перепиской с клиентами с целью продажи наших курсов., Условия:, Работа полностью удаленно / inhome / home office, НЕ ПОДРАБОТКА, полная занятость, График работы: 5/2 по 8 часов, с плавающими выходными (не обязательно Сб и Вс), Заработная плата от 55 000руб. (оклад 15т.руб. + % от продаж), БЕЗ поиска клиентов. БЕЗ холодных звонков, Экологичные продажи, CRM-система с подключенной качественной телефонией., Требования:, Опыт работы в продажах от 1 года (желательно), Дисциплинированность, готовность работать без лишних напоминаний и постоянного контроля, Грамотная устная и письменная речь, Уверенный пользователь ПК, Наличие гарнитуры (наушники с микрофоном), Прохождение обучения и стажировки., Обязанности:, Быстро принимать и обрабатывать входящие заявки, Выявлять потребности и презентовать под них подходящую программу, Работать с клиентской базой (физические лица, которые регистрировались на вебинар), Контролировать поступления денежных средств от клиентов, Предоставлять отчеты по выполнению планов и поставленных задач РОПу., Если любите деньги и продажи, интересуетесь макраме, и готовы стать частью нашей истории, скорее откликайтесь. Мы будем рады рассмотреть вашу кандидатуру"||Среднее|От 2 лет||17.10.2023 22:02:00|20|
