|job_href|job_title|employer|city|salary|schedule|conditions|responsibilities|education|experience|requirements|placement|job_views_value|job_simple_dis_sec
88|https://joblab.ru/vac11053583.html|Менеджер по продажам удаленно|JCat|Ставрополь|40 000 — 200 000 руб.|Полный рабочий день|"Компания WR-Profit уже более 5 лет помогает увеличивать продажи тысячам клиентов, используя новейшие технологии интернет-маркетинга. Среди наших клиентов: крупнейшие банки страны, известные он-лайн школы, сети фитнес-центров, автосалоны и многие другие. Наш продукт подходит любому клиенту, кто хочет развивать свою компанию. Мы являемся официальными партнерами компании ""Big Data."", Сейчас мы расширяемся, и в поиске энергичного и амбициозного менеджера по продажам. Вы будете отвечать за продвижение и продажу наших инновационных продуктов и услуг. Если у вас есть опыт работы в продажах, отличные коммуникативные навыки и стремление достигать результатов, мы приглашаем вас стать частью нашей успешной команды., Условия:, Конкурентную заработную плату и систему премирования, Минимальная оплата труда для менеджера новичка от 40000р лучшие сотрудники получают от 200000р и самое главное это отсутствие потолка в зарплате., Профессиональное развитие и возможность карьерного роста в стабильной компании, Обучение продажам и нашим продуктам, Дружескую и поддерживающую атмосферу в коллективе, Работа из дома, График работы 5/2 сб вс выходные, Использование самых передовых инструментов для продаж и лидогенерации., Увлекательные конференции и выездные мероприятия, Требования:, Опыт работы в продажах приветствуется, но не обязателен (готовы рассмотреть кандидатов без опыта), Умение эффективно коммуницировать и убеждать, находить общий язык с разными типами клиентов, Готовность к активным действиям, неординарным решениям и постоянному саморазвитию, Высокая обучаемость, быстрая адаптация к новым продуктам и рынкам, Уверенный пользователь ПК и социальных сетей, Стремление к достижению результатов и превышению поставленных задач., Обязанности:, Продажа наших услуг по телефону, Работа как с теплой базой (предоставляем) так и поиск новой., Анализировать и понимать потребности клиентов, предлагать наши продукты и услуги, решающие их проблемы, Планировать и проводить презентации продуктов перед потенциальными клиентами, Выстраивать эффективную стратегию продаж, устанавливать и достигать целей продаж, Отслеживать и анализировать результаты продаж, отчитываться о выполнении плановых показателей руководству., Мы ищем талантливых людей, готовых принять вызов и участвовать в нашем захватывающем путешествии к успеху. Присоединяйтесь к нам и станьте частью нашей команды, которая изменяет мир"||Среднее|Не требуется||18.10.2023 07:02:00|39|
89|https://joblab.ru/vac11053603.html|Менеджер по продажам|JCat|Анапа|от 60 000 руб.|Полный рабочий день|||Среднее|От 1 года||18.10.2023 07:02:00|48|
90|https://joblab.ru/vac11053611.html|Менеджер по работе с маркетплейсами|JCat|Новосибирск|от 55 000 руб.|Полный рабочий день|В связи с расширением компании по производству женской одежды под собственной маркой, ведем набор в нашу команду на должность Менеджер по работе с интернет площадками (OZON, WB и другие маркетплейсы), Что вам предстоит делать:, Размещать товар в интернет площадках, Анализировать продажи и подготавливать заказы, Отслеживать и контролировать движения товара, логистику, Работать с ценообразованием, участие в маркетинговых акциях, Увеличивать объемы заказов по интернет площадкам, Отвечать на вопросы и комментарии покупателей, Требования:, Образование: высшее, средне-специальное, Желательно опыт работы с интернет площадками (маркетплейсами), Личные качества: внимательность, аккуратность, стрессоустойчивость, коммуникабельность, исполнительность, ответственность, готовность к обучению и работе в режиме многозадачности, ПК - уверенный пользователь (1С, Excel, Word), Что мы предлагаем:, Стабильная зарплата + премии (зарплата обсуждается по итогам собеседования, все зависит от вашего опыта работы), Трудоустройство по ТК РФ, График работы 5/2 с 8:00 до 17:00, Доброжелательный и дружный коллектив, Офис в центре города, Обучение и возможность развития (тренинги, наставничество, курсы)||Среднее|Не требуется||18.10.2023 07:02:00|50|
91|https://joblab.ru/vac11053612.html|Инженер-монтажник|JCat|Мирный|от 45 000 руб.|Полный рабочий день|Что предстоит делать:, подключать услуги домашнего интернета и ТВ: проводить монтаж оборудования в доме абонента, устранять неисправности при необходимости, помогать клиентам выбрать тариф, настроить роутер или ТВ приставку, показывать, как работает сервис, Для этих задач мы ищем:, специалиста с опытом или без. Наставники научат монтажу и работе с инструментом с нуля, того, кто готов к разъездной работе (в районе проживания), Будет плюсом, если вы уже получили опыт в таких компаниях, как Билайн, Ростелеком, Дом.ру, Эр-Телеком, Таттелеком, но это не обязательно., Что Вы получите, придя к нам:, оформление договора возмездного оказания услуг (договора с самозанятыми) и перспектива перейти в штат, если захотите, ежемесячный доход зависит от количества выполненных заявок (сдельная оплата), возможность дополнительного дохода за привлечение новых клиентов, удобный график работы на выбор: 2/2, 5/2 или другой при полном рабочем дне, поддержку бригадира на старте работы и профессиональное развитие внутри технической команды, возможность увеличивать доход, привлекая новых клиентов., Монтажникам, которые уже работают у нас, особенно нравятся простые задачи и рабочая атмосфера: коллеги готовы помочь, а наставники подсказать., монтажник # монтаж # слаботочные # сети # системы # слаботочка # начинающий # скуд # витая пара # видеонаблюдение # опс # сигнализация # установка # сервисный # техник # технический # специалист #прокладка кабеля # инженер сетей||Среднее|Не требуется||18.10.2023 07:02:00|18|
92|https://joblab.ru/vac11059825.html|Менеджер по продажам|JCat|Москва|70 000 — 100 000 руб.|Полный рабочий день|Условия, На испытательном сроке 2 мес оплата 70000, далее по результатам работы назначается индивидуальный тариф оплаты., График 5/2 при желании 6/1., Премии. Оформление по ТК РФ., Оформление ДМС., Требования:, Деловая чистоплотность, стрессоустойчивость., Опыт работы в сфере оптовых и розничных продаж продуктов питания не менее 2-х лет. Наличие собственной клиентской базы приветствуется., Развитые коммуникативные навыки., Грамотная устная и письменная речь., Готовность к обучению и ориентированность на результат., Обязанности:, Консультирование клиентов по ассортименту продукции., Контроль поставки, оплаты и документооборота., Работа с дебиторской задолженностью., Выполнение плана продаж., Работа в программе 1С:8., Активный поиск и привлечение новых клиентов (звонки, деловые встречи, проведение презентаций и переговоров).Развитие и аналитика продаж.||Среднее|От 2 лет||18.10.2023 07:02:00|30|
93|https://joblab.ru/vac11092203.html|Техник-электрик|JCat|Москва|50 000 — 70 000 руб.|Полный рабочий день|Условия:, График 5/2, при желании 6/1., Транспорт предоставляется работодателем (категория В Ford Transit), На испытательном сроке 2 мес оплата 50000, далее по результатам работы назначается индивидуальный тариф оплаты., Требования:, Наличие навыков работы с техникой, умение диагностики аппаратных неисправностей, методов диагностики и ремонта., Работа носит разъездной характер, ремонт техники на местах ее установки., Опыт от 1 года, можно без опыта работы, выпускника технического колледжа., Аккуратность, пунктуальность, внимательность, умение работать в команде., Обязанности:, Помощь в ремонте, техническом обслуживании, подготовке к работе торговых аппаратов (торговля кофе и снеками) .||Среднее|Не требуется||18.10.2023 07:02:00|33|
94|https://joblab.ru/vac11092210.html|Инженер АСУ ТП|JCat|Обь|от 95 000 руб.|Полный рабочий день|||Среднее|От 2 лет||18.10.2023 07:02:00|99|
95|https://joblab.ru/vac11092261.html|Менеджер по развитию|JCat|Краснодар|40 000 — 120 000 руб.|Полный рабочий день|||Среднее|Не требуется||18.10.2023 07:02:00|35|
96|https://joblab.ru/vac11092273.html|Сетевой инженер|JCat|Москва|100 000 — 120 000 руб.|Полный рабочий день|Обязанности:, Организация бесперебойной работы ИТ инфраструктуры компании (сеть, серверы, виртуализация, корпоративные сервисы), Администрирование, эксплуатация, проектирование и развитие ИТ инфраструктуры и сервисов, Настройка, администрирование, поддержка и мониторинг сетевого оборудования (FW, LAN, WLAN, WAN) на базе Mikrotik, Huawei, Cisco, Настройка, администрирование, поддержка и траблшутинг таких технологий (протоколов) как HSRP, VRRP, OSPF, BGP, VRF, IPsec, Open VPN, GRE, VLAN, Настройка, администрирование, поддержка и мониторинг систем виртуализации на базе Proxmox + Ceph, VMware, Администрирование различных сервисов на базе ОС Linux и Windows Server, Постановка и контроль задач аутсорсингу (подрядным организациям) в вопросах, связанных с поддержкой инфраструктуры, Контроль за качеством предоставляемых услуг провайдерами и поставщиками услуг., Требования:, Знания коммутации и маршрутизации сетей, сетевых протоколов ТСP/IP, технологий построения VPN-соединений и их практическое применение, понимание сетевой модели OSI и принципов работы основных транспортных протоколов, Практический опыт настройки и администрирования сетевого оборудования Mikrotik, Huawei, Cisco, Практический опыт настройки, администрирования, поддержки и траблшутинга таких технологий (протоколов) как HSRP, VRRP, OSPF, BGP, VRF, IPsec, Open VPN, GRE, VLAN, Практический опыт администрирования и внедрения систем виртуализации Proxmox + Ceph, VMware, Практический опыт администрирования серверов на базе ОС Linux и Windows Server, Практический опыт администрирования и внедрения таких сервисов как Zabbix, MySQL, 1C, PostgreSQL и другие., Личные качества:, Внимательность, Планирование и самоорганизация, Исполнительность, Стрессоустойчивость, Ориентация на результат, Ориентир на успешную работу всей команды, Условия:, Место работы: офис м. Алексеевская / м. Рижская, Оформление в соответствии с ТК, Офис в бизнес-центре класса Б+, Перспектива карьерного и профессионального роста, Работа в дружном коллективе, Возможность повышения квалификации на курсах и тренингах, Полная занятость, полный день (возможна частичная удаленка по согласованию с руководителем).||Среднее|От 2 лет||18.10.2023 07:02:00|30|
97|https://joblab.ru/vac11092274.html|Ассистент руководителя в IT-стартап (удаленно)|JCat|Москва|от 32 000 руб.|Полный рабочий день|||Среднее|Не требуется||18.10.2023 07:02:00|104|
98|https://joblab.ru/vac11106402.html|Системный администратор|JCat|Екатеринбург|По договоренности|Подработка|Условия:, Трудоустройство согласно ТК РФ, Достойный уровень заработной платы, Место: Свердловская область, г. Березовский, ул. Коммуны, д. 84, Удаленный график работы с необходимым приездом объект компании для устранения неисправностей или ввода в эксплуатацию нового оборудования, мелкого ремонта имеющегося оборудования, Заработная плата обсуждается при собеседовании, Возможны редкие командировки в г. Златоуст Челябинская область., Требования:, Высшее образование (профильное), Понимание принципов построения и защиты сетей, сервисов, Знание современных ИТ-угроз, а также методов и способов противостояния им, Понимание принципов работы TCP/IP, настройки локальной сети на ПК пользователей знания и опыт в администрировании сетей, серверов, Знание аппаратной части ПК, умение диагностировать и устранять неполадки, Знание операционных систем Windows (опыт установки, восстановления операционных систем после аппаратных сбоев, вирусного заражения и пр.), Оперативность и скорость выполнения задач., Обязанности:, Анализ сетевой инфраструктуры и разработка решений в области информационной безопасности для выполнения требований законодательства, Разработка организационно-распорядительных документов по защите персональных данных в соответствии с текущим законодательством, Проведение мероприятий по категорированию объектов критической информационной структуры, Разработка, внедрение и контроль политик безопасности, Идентификация атак и их блокировка, Поддержка работоспособности, администрирование и обеспечение бесперебойной работы специальных средств защиты информации, Работа с электронными подписями, Работа со средствами криптографической защиты информации (установка, настройка, поддержка), Настройка сетевых приложений (эл. почта, браузеры и пр.)·, Подключение и обслуживание оргтехники (МФУ, принтеры, сканеры), Консультирование пользователей.||Среднее|От 3 лет||18.10.2023 07:02:00|17|
99|https://joblab.ru/vac11106414.html|Инженер- монтажник|JCat|Иваново|от 100 000 руб.|Полный рабочий день|Что предстоит делать:, подключать услуги домашнего интернета и ТВ: проводить монтаж оборудования в доме абонента, устранять неисправности при необходимости, помогать клиентам выбрать тариф, настроить роутер или ТВ приставку, показывать, как работает сервис, Для этих задач мы ищем:, специалиста с опытом подключения домашнего интернета и ТВ или специалиста, умеющего работать со слаботочными системами/электрикой, того, кто готов к разъездной работе и имеет действующее водительское удостоверение категории В., Будет плюсом, если вы получили необходимый опыт в таких компаниях, как Билайн, Ростелеком, Дом.ру, Эр-Телеком, Таттелеком., Что Вы получите, придя к нам:, стабильность: у нас официальное оформление по ТК и медицинская страховка, ежемесячный доход: оклад + премии за количество выполненных заявок, возможность дополнительного дохода за привлечение новых клиентов, удобный график работы на выбор 2/2 и возможность работать недалеко от дома, оплату мобильной связи, безлимитный мобильный интернет и компенсацию ГСМ, профессиональное развитие внутри технической команды, возможность увеличивать доход, привлекая новых клиентов, Монтажникам, которые уже работают у нас, особенно нравятся простые задачи и рабочая атмосфера: коллеги готовы помочь, а наставники подсказать., Если Вам интересно работать с подключением телеком-услуг, будем рады видеть Вас в технической команде МТС||Среднее|Не требуется||18.10.2023 07:02:00|19|
